[
  {
    "file": "Invoice-RAX3IIUH-0002.pdf",
    "vendor": "Anomaly",
    "invoiceNumber": "RAX3IIUH-0002",
    "issueDate": "2026-07-13",
    "dueDate": "2026-07-13",
    "subtotal": 10,
    "total": 10,
    "currency": "USD",
    "vendorEmail": "help@anoma.ly",
    "address": "2443 Fillmore Street #380 6343, San Francisco, California 94115, Verenigde Staten",
    "lineItems": [
      { "description": "OpenCode Go", "quantity": 1, "unitPrice": 10, "amount": 10 }
    ]
  },
  {
    "file": "factuur_2607551285.pdf",
    "vendor": "50+ Mobiel",
    "invoiceNumber": "2607551285",
    "issueDate": "2026-06-27",
    "subtotal": 0,
    "total": 0,
    "currency": "EUR",
    "iban": "NL50ABNA0403612101",
    "vatNumber": "NL815982434B01",
    "businessRegistrationNumber": "27289206",
    "vendorEmail": "info@mobiel.nl",
    "address": "Nieuwstraat 22, 2266AD Leidschendam",
    "lineItems": [
      { "description": "50+ Mobiel 2 jaar sim only", "amount": 0 }
    ]
  }
]
